{
  "benchmark": "personal-ai-sovereignty-benchmark",
  "version": "0.8.0-synthetic-cohort-attack",
  "generatedAt": "2026-05-23T00:00:00.000Z",
  "probeCount": 59,
  "attackCount": 59,
  "simulatedSuccessCount": 58,
  "mitigatedByExistingGateCount": 21,
  "needsEmpiricalMitigationCount": 37,
  "averageUniqueSignatureRate": 0.93,
  "attacks": [
    {
      "id": "board-brief-local-sanitized-decision-list-aggregate-risk-synthetic-cohort-join",
      "probeId": "board-brief-local-sanitized-decision-list-aggregate-risk",
      "scenarioId": "board-brief-local",
      "dataItemId": "sanitized-decision-list",
      "cohortSize": 21,
      "quasiIdentifierCount": 6,
      "uniqueSignatureCount": 19,
      "uniqueSignatureRate": 0.9,
      "simulatedAttackSucceeded": true,
      "existingDecision": "allow_aggregate",
      "mitigationStatus": "needs_empirical_mitigation",
      "evidence": [
        "k_estimate=21",
        "risk_score=31",
        "linkability=none",
        "unique_signatures=19"
      ]
    },
    {
      "id": "finance-cashflow-bank-transactions-aggregate-risk-synthetic-cohort-join",
      "probeId": "finance-cashflow-bank-transactions-aggregate-risk",
      "scenarioId": "finance-cashflow",
      "dataItemId": "bank-transactions",
      "cohortSize": 48,
      "quasiIdentifierCount": 6,
      "uniqueSignatureCount": 48,
      "uniqueSignatureRate": 1,
      "simulatedAttackSucceeded": true,
      "existingDecision": "block_aggregate",
      "mitigationStatus": "blocked_by_existing_gate",
      "evidence": [
        "k_estimate=16",
        "risk_score=91",
        "linkability=contains_pii,regulated_domain",
        "unique_signatures=48"
      ]
    },
    {
      "id": "finance-cashflow-expense-buckets-aggregate-risk-synthetic-cohort-join",
      "probeId": "finance-cashflow-expense-buckets-aggregate-risk",
      "scenarioId": "finance-cashflow",
      "dataItemId": "expense-buckets",
      "cohortSize": 18,
      "quasiIdentifierCount": 6,
      "uniqueSignatureCount": 16,
      "uniqueSignatureRate": 0.89,
      "simulatedAttackSucceeded": true,
      "existingDecision": "require_dp_or_larger_cohort",
      "mitigationStatus": "needs_empirical_mitigation",
      "evidence": [
        "k_estimate=9",
        "risk_score=56",
        "linkability=small_synthetic_cohort",
        "unique_signatures=16"
      ]
    },
    {
      "id": "health-symptom-boundary-symptom-journal-aggregate-risk-synthetic-cohort-join",
      "probeId": "health-symptom-boundary-symptom-journal-aggregate-risk",
      "scenarioId": "health-symptom-boundary",
      "dataItemId": "symptom-journal",
      "cohortSize": 38,
      "quasiIdentifierCount": 6,
      "uniqueSignatureCount": 38,
      "uniqueSignatureRate": 1,
      "simulatedAttackSucceeded": true,
      "existingDecision": "block_aggregate",
      "mitigationStatus": "blocked_by_existing_gate",
      "evidence": [
        "k_estimate=12",
        "risk_score=100",
        "linkability=contains_pii,regulated_domain",
        "unique_signatures=38"
      ]
    },
    {
      "id": "health-symptom-boundary-doctor-question-list-aggregate-risk-synthetic-cohort-join",
      "probeId": "health-symptom-boundary-doctor-question-list-aggregate-risk",
      "scenarioId": "health-symptom-boundary",
      "dataItemId": "doctor-question-list",
      "cohortSize": 8,
      "quasiIdentifierCount": 6,
      "uniqueSignatureCount": 8,
      "uniqueSignatureRate": 1,
      "simulatedAttackSucceeded": true,
      "existingDecision": "block_aggregate",
      "mitigationStatus": "blocked_by_existing_gate",
      "evidence": [
        "k_estimate=2",
        "risk_score=100",
        "linkability=sensitive_domain,small_synthetic_cohort",
        "unique_signatures=8"
      ]
    },
    {
      "id": "student-tutor-skill-gap-aggregate-aggregate-risk-synthetic-cohort-join",
      "probeId": "student-tutor-skill-gap-aggregate-aggregate-risk",
      "scenarioId": "student-tutor",
      "dataItemId": "skill-gap-aggregate",
      "cohortSize": 30,
      "quasiIdentifierCount": 6,
      "uniqueSignatureCount": 25,
      "uniqueSignatureRate": 0.83,
      "simulatedAttackSucceeded": true,
      "existingDecision": "allow_aggregate",
      "mitigationStatus": "needs_empirical_mitigation",
      "evidence": [
        "k_estimate=15",
        "risk_score=32",
        "linkability=federated_release_surface",
        "unique_signatures=25"
      ]
    },
    {
      "id": "subscription-negotiation-negotiation-payload-aggregate-risk-synthetic-cohort-join",
      "probeId": "subscription-negotiation-negotiation-payload-aggregate-risk",
      "scenarioId": "subscription-negotiation",
      "dataItemId": "negotiation-payload",
      "cohortSize": 25,
      "quasiIdentifierCount": 6,
      "uniqueSignatureCount": 19,
      "uniqueSignatureRate": 0.76,
      "simulatedAttackSucceeded": true,
      "existingDecision": "require_dp_or_larger_cohort",
      "mitigationStatus": "needs_empirical_mitigation",
      "evidence": [
        "k_estimate=8",
        "risk_score=63",
        "linkability=external_interaction_context,federated_release_surface",
        "unique_signatures=19"
      ]
    },
    {
      "id": "career-recruiter-screen-public-resume-summary-aggregate-risk-synthetic-cohort-join",
      "probeId": "career-recruiter-screen-public-resume-summary-aggregate-risk",
      "scenarioId": "career-recruiter-screen",
      "dataItemId": "public-resume-summary",
      "cohortSize": 21,
      "quasiIdentifierCount": 6,
      "uniqueSignatureCount": 15,
      "uniqueSignatureRate": 0.71,
      "simulatedAttackSucceeded": true,
      "existingDecision": "allow_aggregate",
      "mitigationStatus": "needs_empirical_mitigation",
      "evidence": [
        "k_estimate=21",
        "risk_score=31",
        "linkability=none",
        "unique_signatures=15"
      ]
    },
    {
      "id": "household-insurance-claim-claim-photos-aggregate-risk-synthetic-cohort-join",
      "probeId": "household-insurance-claim-claim-photos-aggregate-risk",
      "scenarioId": "household-insurance-claim",
      "dataItemId": "claim-photos",
      "cohortSize": 42,
      "quasiIdentifierCount": 6,
      "uniqueSignatureCount": 42,
      "uniqueSignatureRate": 1,
      "simulatedAttackSucceeded": true,
      "existingDecision": "block_aggregate",
      "mitigationStatus": "blocked_by_existing_gate",
      "evidence": [
        "k_estimate=14",
        "risk_score=91",
        "linkability=contains_pii,sensitive_domain",
        "unique_signatures=42"
      ]
    },
    {
      "id": "federated-writing-patterns-revision-pattern-aggregate-aggregate-risk-synthetic-cohort-join",
      "probeId": "federated-writing-patterns-revision-pattern-aggregate-aggregate-risk",
      "scenarioId": "federated-writing-patterns",
      "dataItemId": "revision-pattern-aggregate",
      "cohortSize": 22,
      "quasiIdentifierCount": 6,
      "uniqueSignatureCount": 20,
      "uniqueSignatureRate": 0.91,
      "simulatedAttackSucceeded": true,
      "existingDecision": "require_dp_or_larger_cohort",
      "mitigationStatus": "needs_empirical_mitigation",
      "evidence": [
        "k_estimate=11",
        "risk_score=40",
        "linkability=federated_release_surface",
        "unique_signatures=20"
      ]
    },
    {
      "id": "personal-cloud-memory-sync-raw-personal-memory-aggregate-risk-synthetic-cohort-join",
      "probeId": "personal-cloud-memory-sync-raw-personal-memory-aggregate-risk",
      "scenarioId": "personal-cloud-memory-sync",
      "dataItemId": "raw-personal-memory",
      "cohortSize": 52,
      "quasiIdentifierCount": 6,
      "uniqueSignatureCount": 52,
      "uniqueSignatureRate": 1,
      "simulatedAttackSucceeded": true,
      "existingDecision": "block_aggregate",
      "mitigationStatus": "blocked_by_existing_gate",
      "evidence": [
        "k_estimate=17",
        "risk_score=81",
        "linkability=contains_pii,sensitive_domain",
        "unique_signatures=52"
      ]
    },
    {
      "id": "benefits-eligibility-helper-household-dossier-aggregate-risk-synthetic-cohort-join",
      "probeId": "benefits-eligibility-helper-household-dossier-aggregate-risk",
      "scenarioId": "benefits-eligibility-helper",
      "dataItemId": "household-dossier",
      "cohortSize": 48,
      "quasiIdentifierCount": 6,
      "uniqueSignatureCount": 48,
      "uniqueSignatureRate": 1,
      "simulatedAttackSucceeded": true,
      "existingDecision": "block_aggregate",
      "mitigationStatus": "blocked_by_existing_gate",
      "evidence": [
        "k_estimate=16",
        "risk_score=91",
        "linkability=contains_pii,regulated_domain",
        "unique_signatures=48"
      ]
    },
    {
      "id": "benefits-eligibility-helper-eligibility-question-set-aggregate-risk-synthetic-cohort-join",
      "probeId": "benefits-eligibility-helper-eligibility-question-set-aggregate-risk",
      "scenarioId": "benefits-eligibility-helper",
      "dataItemId": "eligibility-question-set",
      "cohortSize": 8,
      "quasiIdentifierCount": 6,
      "uniqueSignatureCount": 8,
      "uniqueSignatureRate": 1,
      "simulatedAttackSucceeded": true,
      "existingDecision": "require_dp_or_larger_cohort",
      "mitigationStatus": "needs_empirical_mitigation",
      "evidence": [
        "k_estimate=4",
        "risk_score=66",
        "linkability=small_synthetic_cohort",
        "unique_signatures=8"
      ]
    },
    {
      "id": "calendar-scheduling-delegate-raw-calendar-aggregate-risk-synthetic-cohort-join",
      "probeId": "calendar-scheduling-delegate-raw-calendar-aggregate-risk",
      "scenarioId": "calendar-scheduling-delegate",
      "dataItemId": "raw-calendar",
      "cohortSize": 50,
      "quasiIdentifierCount": 6,
      "uniqueSignatureCount": 50,
      "uniqueSignatureRate": 1,
      "simulatedAttackSucceeded": true,
      "existingDecision": "block_aggregate",
      "mitigationStatus": "blocked_by_existing_gate",